title,text,subject,date
"Federal Reserve Raises Interest Rates by 0.25%","The Federal Reserve announced today a quarter-point increase in interest rates, citing concerns about inflation. The decision was made after careful analysis of economic data. Economists have mixed reactions to the move, with some supporting the decision while others express concern about potential impacts on economic growth.","finance","October 26, 2025"
"New Study Shows Exercise Benefits Heart Health","A peer-reviewed study published in the Journal of Medicine found that regular cardiovascular exercise significantly reduces the risk of heart disease. The research involved 10,000 participants over five years. Lead researcher Dr. Smith emphasized the importance of consulting with healthcare providers before starting any exercise program.","health","October 27, 2025"
"City Council Approves New Park Construction","The city council voted 7-2 yesterday to approve funding for a new community park in the downtown area. The project will cost $2.5 million and is expected to be completed by next year. Council member Johnson cited community feedback and the need for more green spaces as reasons for supporting the measure.","local","October 28, 2025"
"Technology Company Reports Quarterly Earnings","Tech giant XYZ Corp announced quarterly earnings that exceeded analyst expectations, with revenue of $15 billion and profit of $3 billion. CEO Jane Doe attributed the success to strong product sales and strategic investments. Stock prices rose 5% following the announcement in after-hours trading.","business","October 29, 2025"
"University Researchers Develop New Solar Panel","Scientists at State University have developed a more efficient solar panel that converts 30% of sunlight into electricity, up from the current 20% industry standard. The research, funded by the Department of Energy, was published in Nature Energy. Commercial applications are expected in 3-5 years pending further testing.","science","October 30, 2025"
"Local School Receives National Recognition","Lincoln High School was recognized by the Department of Education for excellence in STEM education. Principal Martinez accepted the award at a ceremony in Washington DC. The school's robotics team has won multiple competitions and 95% of graduates pursue higher education.","education","October 31, 2025"
"Weather Service Predicts Heavy Rain This Week","The National Weather Service issued a forecast calling for 2-4 inches of rain across the region from Wednesday through Friday. Meteorologist Brown advises residents to prepare for possible localized flooding in low-lying areas. Temperatures will range from 55-65 degrees Fahrenheit.","weather","November 1, 2025"
"Supreme Court Hears Arguments in Privacy Case","The US Supreme Court heard oral arguments today in a case regarding digital privacy rights. The case involves whether law enforcement needs a warrant to access cell phone location data. Legal experts expect a decision by June and note the case could set important precedent.","law","November 2, 2025"
"International Climate Summit Concludes","Representatives from 150 countries concluded a week-long climate summit with new commitments to reduce carbon emissions. The agreement includes specific targets for renewable energy adoption and funding for developing nations. Environmental groups expressed cautious optimism about the pledges.","environment","November 3, 2025"
"Hospital Announces Expansion Plans","Memorial Hospital announced plans to build a new wing dedicated to cancer treatment, adding 50 beds and state-of-the-art equipment. The $50 million project is funded through donations and grants. Construction is scheduled to begin next spring with completion expected in 18 months.","health","November 4, 2025"
"Transportation Authority Releases Traffic Study","The Regional Transportation Authority released a comprehensive study of traffic patterns showing congestion has increased 15% over the past three years. The study recommends investments in public transit and road improvements. Public comment period is open for 60 days.","transportation","November 5, 2025"
"Museum Opens New Exhibition on Ancient History","The City Museum opened a new exhibition featuring artifacts from ancient civilizations. The collection includes items on loan from international museums and spans 3,000 years of history. Curator Davis says the exhibition offers educational opportunities for visitors of all ages.","culture","November 6, 2025"
"Agricultural Report Shows Crop Yields Up","The Department of Agriculture reported corn and wheat yields increased 8% this year due to favorable weather conditions and improved farming techniques. Prices are expected to remain stable. Farmers expressed optimism about the harvest season while noting ongoing challenges with costs.","agriculture","November 7, 2025"
"Police Department Releases Crime Statistics","The police department's annual report shows overall crime decreased 3% last year, with property crime down 5% but violent crime up 2%. Chief Thompson discussed community policing initiatives and plans to address concerns. The report includes detailed breakdowns by neighborhood and crime type.","crime","November 8, 2025"
"Theater Company Announces New Season","The Performing Arts Center announced its upcoming season featuring classic plays and new productions. Season tickets are on sale now with subscriptions starting at $200. Artistic director Lee promises a diverse lineup appealing to various audiences and age groups.","arts","November 9, 2025"
"Economic Report Shows Job Growth","The Bureau of Labor Statistics reported 250,000 new jobs were added last month, exceeding forecasts. Unemployment rate remained steady at 4.5%. Industries showing the most growth include healthcare, technology, and professional services. Economists view the data as indicating continued economic expansion.","economy","November 10, 2025"
"Public Library Launches Digital Services","The public library system introduced new digital services including e-book lending and online learning resources. Library director Chen said the expansion addresses community needs and provides 24/7 access. Usage of digital services has increased 40% in the past year.","education","November 11, 2025"
"Infrastructure Project Reaches Milestone","The city's bridge renovation project reached the halfway point this week, remaining on schedule and within budget. Engineers report the structure will be reinforced to meet current safety standards. The project is expected to be completed by spring with minimal traffic disruption.","infrastructure","November 12, 2025"
"Medical Research Team Makes Cancer Discovery","Researchers at the Medical Center identified a protein that may help diagnose certain cancers earlier. The findings, published in Science, are based on three years of laboratory research. Dr. Williams emphasized this is early-stage research requiring further study before clinical applications.","medical","November 13, 2025"
"Sports Team Wins Championship Game","The home team won the championship in a decisive 28-21 victory yesterday evening. Quarterback Martinez threw three touchdown passes before a crowd of 65,000 fans. This marks the team's first championship in 15 years. Victory parade is scheduled for downtown this Saturday.","sports","November 14, 2025"
